{
  "schema_version": 1,
  "run_id": "20260720T181212Z-f860526f",
  "scenario_id": "streaming-weather",
  "turns": [
    {
      "index": 0,
      "request": {
        "method": "POST",
        "url": "http://localhost:11434/v1/chat/completions",
        "headers": {
          "content-type": "application/json"
        },
        "body": {
          "max_tokens": 1024,
          "messages": [
            {
              "content": "Use get_weather for Seattle.",
              "role": "user"
            }
          ],
          "model": "qwen2.5:7b-instruct",
          "seed": 42,
          "stream": true,
          "temperature": 0.0,
          "tool_choice": {
            "function": {
              "name": "get_weather"
            },
            "type": "function"
          },
          "tools": [
            {
              "function": {
                "description": "Get the current weather for a city.",
                "name": "get_weather",
                "parameters": {
                  "properties": {
                    "city": {
                      "type": "string"
                    }
                  },
                  "required": [
                    "city"
                  ],
                  "type": "object"
                }
              },
              "type": "function"
            }
          ],
          "top_p": 1.0
        }
      },
      "response": {
        "status": 200,
        "headers": {
          "content-type": "text/event-stream",
          "date": "Mon, 20 Jul 2026 18:12:47 GMT",
          "transfer-encoding": "chunked"
        },
        "body_raw": "data: {\"id\":\"chatcmpl-131\",\"object\":\"chat.completion.chunk\",\"created\":1784571167,\"model\":\"qwen2.5:7b-instruct\",\"system_fingerprint\":\"fp_ollama\",\"choices\":[{\"index\":0,\"delta\":{\"role\":\"assistant\",\"content\":\"\",\"tool_calls\":[{\"id\":\"call_awu4ynaq\",\"index\":0,\"type\":\"function\",\"function\":{\"name\":\"get_weather\",\"arguments\":\"{\\\"city\\\":\\\"Seattle\\\"}\"}}]},\"finish_reason\":null}]}\n\ndata: {\"id\":\"chatcmpl-131\",\"object\":\"chat.completion.chunk\",\"created\":1784571167,\"model\":\"qwen2.5:7b-instruct\",\"system_fingerprint\":\"fp_ollama\",\"choices\":[{\"index\":0,\"delta\":{\"role\":\"assistant\",\"content\":\"\"},\"finish_reason\":\"tool_calls\"}]}\n\ndata: [DONE]\n\n"
      },
      "retried": false
    }
  ]
}
