{
  "schema_version": 1,
  "run_id": "20260720T143541Z-84234757",
  "scenario_id": "streaming-weather",
  "turns": [
    {
      "index": 0,
      "request": {
        "method": "POST",
        "url": "http://localhost:11434/v1/chat/completions",
        "headers": {
          "content-type": "application/json"
        },
        "body": {
          "max_tokens": 1024,
          "messages": [
            {
              "content": "Use get_weather for Seattle.",
              "role": "user"
            }
          ],
          "model": "gemma3:12b",
          "seed": 42,
          "stream": true,
          "temperature": 0.0,
          "tool_choice": {
            "function": {
              "name": "get_weather"
            },
            "type": "function"
          },
          "tools": [
            {
              "function": {
                "description": "Get the current weather for a city.",
                "name": "get_weather",
                "parameters": {
                  "properties": {
                    "city": {
                      "type": "string"
                    }
                  },
                  "required": [
                    "city"
                  ],
                  "type": "object"
                }
              },
              "type": "function"
            }
          ],
          "top_p": 1.0
        }
      },
      "response": {
        "status": 400,
        "headers": {
          "content-length": "141",
          "content-type": "application/json",
          "date": "Mon, 20 Jul 2026 14:35:47 GMT"
        },
        "body_raw": "{\"error\":{\"message\":\"registry.ollama.ai/library/gemma3:12b does not support tools\",\"type\":\"invalid_request_error\",\"param\":null,\"code\":null}}\n"
      },
      "retried": false
    }
  ]
}
