{
  "schema_version": 1,
  "run_id": "20260720T185633Z-b808ab3d",
  "scenario_id": "parallel-three-cities",
  "turns": [
    {
      "index": 0,
      "request": {
        "method": "POST",
        "url": "http://127.0.0.1:8080/v1/chat/completions",
        "headers": {
          "content-type": "application/json"
        },
        "body": {
          "max_tokens": 1024,
          "messages": [
            {
              "content": "Get weather for Austin, Dublin, and Seoul with three calls.",
              "role": "user"
            }
          ],
          "model": "bartowski/Meta-Llama-3.1-8B-Instruct-GGUF:Q8_0",
          "seed": 42,
          "stream": false,
          "temperature": 0.0,
          "tool_choice": "required",
          "tools": [
            {
              "function": {
                "description": "Get weather for a city.",
                "name": "get_weather",
                "parameters": {
                  "properties": {
                    "city": {
                      "type": "string"
                    }
                  },
                  "required": [
                    "city"
                  ],
                  "type": "object"
                }
              },
              "type": "function"
            }
          ],
          "top_p": 1.0
        }
      },
      "response": {
        "status": 200,
        "headers": {
          "access-control-allow-origin": "",
          "content-length": "820",
          "content-type": "application/json; charset=utf-8",
          "keep-alive": "timeout=5, max=100",
          "server": "llama.cpp"
        },
        "body_raw": "{\"choices\":[{\"finish_reason\":\"tool_calls\",\"index\":0,\"message\":{\"role\":\"assistant\",\"content\":\"\",\"tool_calls\":[{\"type\":\"function\",\"function\":{\"name\":\"get_weather\",\"arguments\":\"{\\\"city\\\": \\\"Austin\\\"}\"},\"id\":\"NXpDQwaGjAsqfnRrop612BoHuTsT06Cv\"}]}}],\"created\":1784573815,\"model\":\"bartowski/Meta-Llama-3.1-8B-Instruct-GGUF:Q8_0\",\"system_fingerprint\":\"b10050-b15ca938a\",\"object\":\"chat.completion\",\"usage\":{\"completion_tokens\":18,\"prompt_tokens\":185,\"total_tokens\":203,\"prompt_tokens_details\":{\"cached_tokens\":167}},\"id\":\"chatcmpl-Mktck4sHB7jDBai8NN8j0zzrkynkZXe9\",\"timings\":{\"cache_n\":167,\"prompt_n\":18,\"prompt_ms\":55.349,\"prompt_per_token_ms\":3.0749444444444443,\"prompt_per_second\":325.20912753617955,\"predicted_n\":18,\"predicted_ms\":306.518,\"predicted_per_token_ms\":17.028777777777776,\"predicted_per_second\":58.72412060629392}}"
      },
      "retried": false
    }
  ]
}
