{
  "schema_version": 1,
  "run_id": "20260720T182604Z-d59df055",
  "scenario_id": "parallel-city-time",
  "turns": [
    {
      "index": 0,
      "request": {
        "method": "POST",
        "url": "http://127.0.0.1:8080/v1/chat/completions",
        "headers": {
          "content-type": "application/json"
        },
        "body": {
          "max_tokens": 1024,
          "messages": [
            {
              "content": "What time is it in Boston and Tokyo?",
              "role": "user"
            }
          ],
          "model": "Qwen/Qwen2.5-7B-Instruct-GGUF:Q8_0",
          "seed": 42,
          "stream": false,
          "temperature": 0.0,
          "tool_choice": "required",
          "tools": [
            {
              "function": {
                "description": "Get the local time for a city.",
                "name": "get_time",
                "parameters": {
                  "properties": {
                    "city": {
                      "type": "string"
                    }
                  },
                  "required": [
                    "city"
                  ],
                  "type": "object"
                }
              },
              "type": "function"
            }
          ],
          "top_p": 1.0
        }
      },
      "response": {
        "status": 200,
        "headers": {
          "access-control-allow-origin": "",
          "content-length": "929",
          "content-type": "application/json; charset=utf-8",
          "keep-alive": "timeout=5, max=100",
          "server": "llama.cpp"
        },
        "body_raw": "{\"choices\":[{\"finish_reason\":\"tool_calls\",\"index\":0,\"message\":{\"role\":\"assistant\",\"content\":\"\",\"tool_calls\":[{\"type\":\"function\",\"function\":{\"name\":\"get_time\",\"arguments\":\"{\\\"city\\\": \\\"Boston\\\"}\"},\"id\":\"fRggnmzmoLkStyc7nRmnjlPgpx38wcSx\"},{\"type\":\"function\",\"function\":{\"name\":\"get_time\",\"arguments\":\"{\\\"city\\\": \\\"Tokyo\\\"}\"},\"id\":\"irPAvRouTBpw2jDF110yXh6gbnYmeKIJ\"}]}}],\"created\":1784571983,\"model\":\"Qwen/Qwen2.5-7B-Instruct-GGUF:Q8_0\",\"system_fingerprint\":\"b10050-b15ca938a\",\"object\":\"chat.completion\",\"usage\":{\"completion_tokens\":41,\"prompt_tokens\":174,\"total_tokens\":215,\"prompt_tokens_details\":{\"cached_tokens\":68}},\"id\":\"chatcmpl-4tvQSpFhEc1i0hviyfl2a4zp4edl4SOp\",\"timings\":{\"cache_n\":68,\"prompt_n\":106,\"prompt_ms\":138.053,\"prompt_per_token_ms\":1.30238679245283,\"prompt_per_second\":767.8210542327947,\"predicted_n\":41,\"predicted_ms\":678.705,\"predicted_per_token_ms\":16.55378048780488,\"predicted_per_second\":60.409161565039305}}"
      },
      "retried": false
    }
  ]
}
