{
  "schema_version": 1,
  "run_id": "20260720T190726Z-21133f9c",
  "scenario_id": "parallel-three-different-tools",
  "turns": [
    {
      "index": 0,
      "request": {
        "method": "POST",
        "url": "http://127.0.0.1:8080/v1/chat/completions",
        "headers": {
          "content-type": "application/json"
        },
        "body": {
          "max_tokens": 1024,
          "messages": [
            {
              "content": "Get weather in Rome, time in Nairobi, and convert 25 USD to EUR.",
              "role": "user"
            }
          ],
          "model": "Qwen/Qwen2.5-1.5B-Instruct-GGUF:Q8_0",
          "seed": 42,
          "stream": false,
          "temperature": 0.0,
          "tool_choice": "required",
          "tools": [
            {
              "function": {
                "description": "Get weather for a city.",
                "name": "get_weather",
                "parameters": {
                  "properties": {
                    "city": {
                      "type": "string"
                    }
                  },
                  "required": [
                    "city"
                  ],
                  "type": "object"
                }
              },
              "type": "function"
            },
            {
              "function": {
                "description": "Get local time for a city.",
                "name": "get_time",
                "parameters": {
                  "properties": {
                    "city": {
                      "type": "string"
                    }
                  },
                  "required": [
                    "city"
                  ],
                  "type": "object"
                }
              },
              "type": "function"
            },
            {
              "function": {
                "description": "Convert an exact currency amount.",
                "name": "convert_currency",
                "parameters": {
                  "properties": {
                    "amount": {
                      "type": "number"
                    },
                    "from": {
                      "type": "string"
                    },
                    "to": {
                      "type": "string"
                    }
                  },
                  "required": [
                    "amount",
                    "from",
                    "to"
                  ],
                  "type": "object"
                }
              },
              "type": "function"
            }
          ],
          "top_p": 1.0
        }
      },
      "response": {
        "status": 200,
        "headers": {
          "access-control-allow-origin": "",
          "content-length": "1092",
          "content-type": "application/json; charset=utf-8",
          "keep-alive": "timeout=5, max=100",
          "server": "llama.cpp"
        },
        "body_raw": "{\"choices\":[{\"finish_reason\":\"tool_calls\",\"index\":0,\"message\":{\"role\":\"assistant\",\"content\":\"\",\"tool_calls\":[{\"type\":\"function\",\"function\":{\"name\":\"get_weather\",\"arguments\":\"{\\\"city\\\": \\\"Rome\\\"}\"},\"id\":\"WV9y4ZaQkXqxY7FAf3E26Nxa0Y3frxao\"},{\"type\":\"function\",\"function\":{\"name\":\"get_time\",\"arguments\":\"{\\\"city\\\": \\\"Nairobi\\\"}\"},\"id\":\"vqKRvNOtcMGJUBYc46ta0ZFuSdojVOCW\"},{\"type\":\"function\",\"function\":{\"name\":\"convert_currency\",\"arguments\":\"{\\\"amount\\\": 25, \\\"from\\\": \\\"USD\\\", \\\"to\\\": \\\"EUR\\\"}\"},\"id\":\"xpu1cgVxpq3c4oBlPNrbL0V20Mj4L8Dc\"}]}}],\"created\":1784574451,\"model\":\"Qwen/Qwen2.5-1.5B-Instruct-GGUF:Q8_0\",\"system_fingerprint\":\"b10050-b15ca938a\",\"object\":\"chat.completion\",\"usage\":{\"completion_tokens\":75,\"prompt_tokens\":316,\"total_tokens\":391,\"prompt_tokens_details\":{\"cached_tokens\":165}},\"id\":\"chatcmpl-aMVuWxMkaCU3uDSzjAC4SG7xWguKLxUx\",\"timings\":{\"cache_n\":165,\"prompt_n\":151,\"prompt_ms\":43.326,\"prompt_per_token_ms\":0.2869271523178808,\"prompt_per_second\":3485.205188570373,\"predicted_n\":75,\"predicted_ms\":372.474,\"predicted_per_token_ms\":4.96632,\"predicted_per_second\":201.3563362811901}}"
      },
      "retried": false
    }
  ]
}
