{
  "schema_version": 1,
  "run_id": "20260720T143302Z-0c5daa9d",
  "scenario_id": "single-boolean-flag",
  "turns": [
    {
      "index": 0,
      "request": {
        "method": "POST",
        "url": "http://localhost:11434/v1/chat/completions",
        "headers": {
          "content-type": "application/json"
        },
        "body": {
          "max_tokens": 1024,
          "messages": [
            {
              "content": "Disable the feature named audit-log.",
              "role": "user"
            }
          ],
          "model": "hermes3:8b",
          "seed": 42,
          "stream": false,
          "temperature": 0.0,
          "tool_choice": "auto",
          "tools": [
            {
              "function": {
                "description": "Enable or disable a feature.",
                "name": "set_feature",
                "parameters": {
                  "properties": {
                    "enabled": {
                      "type": "boolean"
                    },
                    "feature": {
                      "type": "string"
                    }
                  },
                  "required": [
                    "feature",
                    "enabled"
                  ],
                  "type": "object"
                }
              },
              "type": "function"
            }
          ],
          "top_p": 1.0
        }
      },
      "response": {
        "status": 200,
        "headers": {
          "content-length": "287",
          "content-type": "application/json",
          "date": "Mon, 20 Jul 2026 14:33:25 GMT"
        },
        "body_raw": "{\"id\":\"chatcmpl-823\",\"object\":\"chat.completion\",\"created\":1784558005,\"model\":\"hermes3:8b\",\"system_fingerprint\":\"fp_ollama\",\"choices\":[{\"index\":0,\"message\":{\"role\":\"assistant\",\"content\":\"\"},\"finish_reason\":\"stop\"}],\"usage\":{\"prompt_tokens\":236,\"completion_tokens\":26,\"total_tokens\":262}}\n"
      },
      "retried": false
    }
  ]
}
