{
  "schema_version": 1,
  "run_id": "20260720T191115Z-c7b8ebe4",
  "scenario_id": "parallel-two-calculations",
  "turns": [
    {
      "index": 0,
      "request": {
        "method": "POST",
        "url": "http://127.0.0.1:8080/v1/chat/completions",
        "headers": {
          "content-type": "application/json"
        },
        "body": {
          "max_tokens": 1024,
          "messages": [
            {
              "content": "Use separate calls to divide 42 by 6 and divide 10 by 4.",
              "role": "user"
            }
          ],
          "model": "watt-tool-8B.Q4_K_M.gguf",
          "seed": 42,
          "stream": false,
          "temperature": 0.0,
          "tool_choice": "required",
          "tools": [
            {
              "function": {
                "description": "Divide one number by another.",
                "name": "divide",
                "parameters": {
                  "properties": {
                    "dividend": {
                      "type": "number"
                    },
                    "divisor": {
                      "type": "number"
                    }
                  },
                  "required": [
                    "dividend",
                    "divisor"
                  ],
                  "type": "object"
                }
              },
              "type": "function"
            }
          ],
          "top_p": 1.0
        }
      },
      "response": {
        "status": 200,
        "headers": {
          "access-control-allow-origin": "",
          "content-length": "841",
          "content-type": "application/json; charset=utf-8",
          "keep-alive": "timeout=5, max=100",
          "server": "llama.cpp"
        },
        "body_raw": "{\"choices\":[{\"finish_reason\":\"stop\",\"index\":0,\"message\":{\"role\":\"assistant\",\"content\":\"The given problem requires separate calls to divide 42 by 6 and 10 by 4. Here are the calculations:\\n\\n1. 42 divided by 6:\\n   - 42 ÷ 6 = 7\\n\\n2. 10 divided by 4:\\n   - 10 ÷ 4 = 2.5\"}}],\"created\":1784574704,\"model\":\"watt-tool-8B.Q4_K_M.gguf\",\"system_fingerprint\":\"b10050-b15ca938a\",\"object\":\"chat.completion\",\"usage\":{\"completion_tokens\":69,\"prompt_tokens\":28,\"total_tokens\":97,\"prompt_tokens_details\":{\"cached_tokens\":5}},\"id\":\"chatcmpl-bq0wOIzn1FkOmvMfzLHvBiyuTKFnz41v\",\"timings\":{\"cache_n\":5,\"prompt_n\":23,\"prompt_ms\":54.439,\"prompt_per_token_ms\":2.366913043478261,\"prompt_per_second\":422.4912287147082,\"predicted_n\":69,\"predicted_ms\":768.336,\"predicted_per_token_ms\":11.135304347826088,\"predicted_per_second\":89.80446054851004}}"
      },
      "retried": false
    }
  ]
}
