{
  "schema_version": 1,
  "run_id": "20260721T160226Z-3d6b0b23",
  "scenario_id": "streaming-parallel-two",
  "turns": [
    {
      "index": 0,
      "request": {
        "method": "POST",
        "url": "http://127.0.0.1:8081/v1/chat/completions",
        "headers": {
          "content-type": "application/json"
        },
        "body": {
          "max_tokens": 1024,
          "messages": [
            {
              "content": "Get the weather in Prague and the local time in Manila.",
              "role": "user"
            }
          ],
          "model": "mlx-community/Qwen2.5-1.5B-Instruct-4bit",
          "seed": 42,
          "stream": true,
          "temperature": 0.0,
          "tool_choice": "required",
          "tools": [
            {
              "function": {
                "description": "Get weather for a city.",
                "name": "get_weather",
                "parameters": {
                  "properties": {
                    "city": {
                      "type": "string"
                    }
                  },
                  "required": [
                    "city"
                  ],
                  "type": "object"
                }
              },
              "type": "function"
            },
            {
              "function": {
                "description": "Get local time for a city.",
                "name": "get_time",
                "parameters": {
                  "properties": {
                    "city": {
                      "type": "string"
                    }
                  },
                  "required": [
                    "city"
                  ],
                  "type": "object"
                }
              },
              "type": "function"
            }
          ],
          "top_p": 1.0
        }
      },
      "response": {
        "status": 200,
        "headers": {
          "access-control-allow-headers": "*",
          "access-control-allow-methods": "*",
          "access-control-allow-origin": "*",
          "cache-control": "no-cache",
          "content-type": "text/event-stream",
          "date": "Tue, 21 Jul 2026 16:02:35 GMT",
          "server": "BaseHTTP/0.6 Python/3.14.6"
        },
        "body_raw": ": keepalive 0/169\n\n: keepalive 168/169\n\n: keepalive 169/169\n\ndata: {\"id\": \"chatcmpl-36e898af-28b9-4cbb-b7ad-a4f424fa73ce\", \"system_fingerprint\": \"0.31.3-0.32.0-macOS-26.5.2-arm64-arm-64bit-Mach-O-applegpu_g16s\", \"object\": \"chat.completion.chunk\", \"model\": \"mlx-community/Qwen2.5-1.5B-Instruct-4bit\", \"created\": 1784649755, \"choices\": [{\"index\": 0, \"finish_reason\": null, \"delta\": {\"role\": \"assistant\", \"tool_calls\": [{\"function\": {\"name\": \"get_weather\", \"arguments\": \"{\\\"city\\\": \\\"Prague\\\"}\"}, \"type\": \"function\", \"id\": \"f16a7e14-1cad-49a8-9a3a-438027c9494b\", \"index\": 0}]}}]}\n\ndata: {\"id\": \"chatcmpl-36e898af-28b9-4cbb-b7ad-a4f424fa73ce\", \"system_fingerprint\": \"0.31.3-0.32.0-macOS-26.5.2-arm64-arm-64bit-Mach-O-applegpu_g16s\", \"object\": \"chat.completion.chunk\", \"model\": \"mlx-community/Qwen2.5-1.5B-Instruct-4bit\", \"created\": 1784649755, \"choices\": [{\"index\": 0, \"finish_reason\": null, \"delta\": {\"role\": \"assistant\", \"content\": \"\\n\"}}]}\n\ndata: {\"id\": \"chatcmpl-36e898af-28b9-4cbb-b7ad-a4f424fa73ce\", \"system_fingerprint\": \"0.31.3-0.32.0-macOS-26.5.2-arm64-arm-64bit-Mach-O-applegpu_g16s\", \"object\": \"chat.completion.chunk\", \"model\": \"mlx-community/Qwen2.5-1.5B-Instruct-4bit\", \"created\": 1784649755, \"choices\": [{\"index\": 0, \"finish_reason\": null, \"delta\": {\"role\": \"assistant\", \"tool_calls\": [{\"function\": {\"name\": \"get_time\", \"arguments\": \"{\\\"city\\\": \\\"Manila\\\"}\"}, \"type\": \"function\", \"id\": \"fe8595e5-a005-4521-a539-ead8afb53888\", \"index\": 1}]}}]}\n\ndata: {\"id\": \"chatcmpl-36e898af-28b9-4cbb-b7ad-a4f424fa73ce\", \"system_fingerprint\": \"0.31.3-0.32.0-macOS-26.5.2-arm64-arm-64bit-Mach-O-applegpu_g16s\", \"object\": \"chat.completion.chunk\", \"model\": \"mlx-community/Qwen2.5-1.5B-Instruct-4bit\", \"created\": 1784649755, \"choices\": [{\"index\": 0, \"finish_reason\": \"tool_calls\", \"delta\": {\"role\": \"assistant\"}}]}\n\ndata: [DONE]\n\n"
      },
      "retried": false
    }
  ]
}
