{
  "schema_version": 1,
  "run_id": "20260720T180523Z-8f80361a",
  "scenario_id": "parallel-three-different-tools",
  "turns": [
    {
      "index": 0,
      "request": {
        "method": "POST",
        "url": "http://localhost:11434/v1/chat/completions",
        "headers": {
          "content-type": "application/json"
        },
        "body": {
          "max_tokens": 1024,
          "messages": [
            {
              "content": "Get weather in Rome, time in Nairobi, and convert 25 USD to EUR.",
              "role": "user"
            }
          ],
          "model": "llama3.1:8b",
          "seed": 42,
          "stream": false,
          "temperature": 0.0,
          "tool_choice": "required",
          "tools": [
            {
              "function": {
                "description": "Get weather for a city.",
                "name": "get_weather",
                "parameters": {
                  "properties": {
                    "city": {
                      "type": "string"
                    }
                  },
                  "required": [
                    "city"
                  ],
                  "type": "object"
                }
              },
              "type": "function"
            },
            {
              "function": {
                "description": "Get local time for a city.",
                "name": "get_time",
                "parameters": {
                  "properties": {
                    "city": {
                      "type": "string"
                    }
                  },
                  "required": [
                    "city"
                  ],
                  "type": "object"
                }
              },
              "type": "function"
            },
            {
              "function": {
                "description": "Convert an exact currency amount.",
                "name": "convert_currency",
                "parameters": {
                  "properties": {
                    "amount": {
                      "type": "number"
                    },
                    "from": {
                      "type": "string"
                    },
                    "to": {
                      "type": "string"
                    }
                  },
                  "required": [
                    "amount",
                    "from",
                    "to"
                  ],
                  "type": "object"
                }
              },
              "type": "function"
            }
          ],
          "top_p": 1.0
        }
      },
      "response": {
        "status": 200,
        "headers": {
          "content-length": "702",
          "content-type": "application/json",
          "date": "Mon, 20 Jul 2026 18:05:43 GMT"
        },
        "body_raw": "{\"id\":\"chatcmpl-26\",\"object\":\"chat.completion\",\"created\":1784570743,\"model\":\"llama3.1:8b\",\"system_fingerprint\":\"fp_ollama\",\"choices\":[{\"index\":0,\"message\":{\"role\":\"assistant\",\"content\":\"\",\"tool_calls\":[{\"id\":\"call_oxa7isrd\",\"index\":0,\"type\":\"function\",\"function\":{\"name\":\"get_weather\",\"arguments\":\"{\\\"city\\\":\\\"Rome\\\"}\"}},{\"id\":\"call_3sh10odb\",\"index\":1,\"type\":\"function\",\"function\":{\"name\":\"get_time\",\"arguments\":\"{\\\"city\\\":\\\"Nairobi\\\"}\"}},{\"id\":\"call_nf0ovqju\",\"index\":2,\"type\":\"function\",\"function\":{\"name\":\"convert_currency\",\"arguments\":\"{\\\"from\\\":\\\"USD\\\",\\\"to\\\":\\\"EUR\\\",\\\"amount\\\":\\\"25\\\"}\"}}]},\"finish_reason\":\"tool_calls\"}],\"usage\":{\"prompt_tokens\":264,\"completion_tokens\":63,\"total_tokens\":327}}\n"
      },
      "retried": false
    }
  ]
}
