{
  "schema_version": 1,
  "run_id": "20260720T143528Z-09b0f838",
  "scenario_id": "parallel-weather-and-time",
  "turns": [
    {
      "index": 0,
      "request": {
        "method": "POST",
        "url": "http://localhost:11434/v1/chat/completions",
        "headers": {
          "content-type": "application/json"
        },
        "body": {
          "max_tokens": 1024,
          "messages": [
            {
              "content": "Get both the weather and local time for Denver.",
              "role": "user"
            }
          ],
          "model": "gemma3:4b",
          "seed": 42,
          "stream": false,
          "temperature": 0.0,
          "tool_choice": "auto",
          "tools": [
            {
              "function": {
                "description": "Get weather for a city.",
                "name": "get_weather",
                "parameters": {
                  "properties": {
                    "city": {
                      "type": "string"
                    }
                  },
                  "required": [
                    "city"
                  ],
                  "type": "object"
                }
              },
              "type": "function"
            },
            {
              "function": {
                "description": "Get local time for a city.",
                "name": "get_time",
                "parameters": {
                  "properties": {
                    "city": {
                      "type": "string"
                    }
                  },
                  "required": [
                    "city"
                  ],
                  "type": "object"
                }
              },
              "type": "function"
            }
          ],
          "top_p": 1.0
        }
      },
      "response": {
        "status": 400,
        "headers": {
          "content-length": "140",
          "content-type": "application/json",
          "date": "Mon, 20 Jul 2026 14:35:32 GMT"
        },
        "body_raw": "{\"error\":{\"message\":\"registry.ollama.ai/library/gemma3:4b does not support tools\",\"type\":\"invalid_request_error\",\"param\":null,\"code\":null}}\n"
      },
      "retried": false
    }
  ]
}
