{
  "schema_version": 1,
  "run_id": "20260720T180246Z-53903d2d",
  "scenario_id": "single-integer-limit",
  "turns": [
    {
      "index": 0,
      "request": {
        "method": "POST",
        "url": "http://localhost:11434/v1/chat/completions",
        "headers": {
          "content-type": "application/json"
        },
        "body": {
          "max_tokens": 1024,
          "messages": [
            {
              "content": "List exactly 12 messages from the support mailbox.",
              "role": "user"
            }
          ],
          "model": "qwen3:8b",
          "seed": 42,
          "stream": false,
          "temperature": 0.0,
          "tool_choice": "auto",
          "tools": [
            {
              "function": {
                "description": "List a fixed number of messages.",
                "name": "list_messages",
                "parameters": {
                  "properties": {
                    "limit": {
                      "type": "integer"
                    },
                    "mailbox": {
                      "type": "string"
                    }
                  },
                  "required": [
                    "mailbox",
                    "limit"
                  ],
                  "type": "object"
                }
              },
              "type": "function"
            }
          ],
          "top_p": 1.0
        }
      },
      "response": {
        "status": 200,
        "headers": {
          "content-length": "843",
          "content-type": "application/json",
          "date": "Mon, 20 Jul 2026 18:04:39 GMT"
        },
        "body_raw": "{\"id\":\"chatcmpl-70\",\"object\":\"chat.completion\",\"created\":1784570679,\"model\":\"qwen3:8b\",\"system_fingerprint\":\"fp_ollama\",\"choices\":[{\"index\":0,\"message\":{\"role\":\"assistant\",\"content\":\"\",\"reasoning\":\"Okay, the user wants me to list exactly 12 messages from the support mailbox. Let me check the tools provided. There's a function called list_messages that takes a limit and a mailbox. The limit is an integer, and the mailbox is a string. So I need to set the limit to 12 and specify the mailbox as \\\"support\\\". Let me make sure the parameters are correct. Yep, that should do it.\\n\",\"tool_calls\":[{\"id\":\"call_t96e81b0\",\"index\":0,\"type\":\"function\",\"function\":{\"name\":\"list_messages\",\"arguments\":\"{\\\"limit\\\":12,\\\"mailbox\\\":\\\"support\\\"}\"}}]},\"finish_reason\":\"tool_calls\"}],\"usage\":{\"prompt_tokens\":149,\"completion_tokens\":119,\"total_tokens\":268}}\n"
      },
      "retried": false
    }
  ]
}
