{
  "schema_version": 1,
  "run_id": "20260721T160109Z-829d726e",
  "scenario_id": "single-array-tags",
  "turns": [
    {
      "index": 0,
      "request": {
        "method": "POST",
        "url": "http://127.0.0.1:8081/v1/chat/completions",
        "headers": {
          "content-type": "application/json"
        },
        "body": {
          "max_tokens": 1024,
          "messages": [
            {
              "content": "Tag document doc-17 with exactly alpha, beta, and gamma in that order.",
              "role": "user"
            }
          ],
          "model": "mlx-community/Qwen2.5-7B-Instruct-8bit",
          "seed": 42,
          "stream": false,
          "temperature": 0.0,
          "tool_choice": "auto",
          "tools": [
            {
              "function": {
                "description": "Apply tags to a document.",
                "name": "tag_document",
                "parameters": {
                  "properties": {
                    "document_id": {
                      "type": "string"
                    },
                    "tags": {
                      "items": {
                        "type": "string"
                      },
                      "type": "array"
                    }
                  },
                  "required": [
                    "document_id",
                    "tags"
                  ],
                  "type": "object"
                }
              },
              "type": "function"
            }
          ],
          "top_p": 1.0
        }
      },
      "response": {
        "status": 200,
        "headers": {
          "access-control-allow-headers": "*",
          "access-control-allow-methods": "*",
          "access-control-allow-origin": "*",
          "content-length": "466",
          "content-type": "application/json",
          "date": "Tue, 21 Jul 2026 16:01:46 GMT",
          "server": "BaseHTTP/0.6 Python/3.14.6"
        },
        "body_raw": "{\"id\": \"chatcmpl-07a65f94-87a4-46e5-a615-b61bf997b1a7\", \"system_fingerprint\": \"0.31.3-0.32.0-macOS-26.5.2-arm64-arm-64bit-Mach-O-applegpu_g16s\", \"object\": \"chat.completion\", \"model\": \"mlx-community/Qwen2.5-7B-Instruct-8bit\", \"created\": 1784649706, \"choices\": [{\"index\": 0, \"finish_reason\": \"tool_calls\", \"message\": {\"role\": \"assistant\"}}], \"usage\": {\"prompt_tokens\": 204, \"completion_tokens\": 39, \"total_tokens\": 243, \"prompt_tokens_details\": {\"cached_tokens\": 61}}}"
      },
      "retried": false
    }
  ]
}
