{
  "schema_version": 1,
  "run_id": "20260720T143138Z-f43975a9",
  "scenario_id": "streaming-parallel-three",
  "turns": [
    {
      "index": 0,
      "request": {
        "method": "POST",
        "url": "http://localhost:11434/v1/chat/completions",
        "headers": {
          "content-type": "application/json"
        },
        "body": {
          "max_tokens": 1024,
          "messages": [
            {
              "content": "Get local time for Accra, Kyoto, and Quito with three calls.",
              "role": "user"
            }
          ],
          "model": "qwen2.5:7b-instruct",
          "seed": 42,
          "stream": true,
          "temperature": 0.0,
          "tool_choice": "required",
          "tools": [
            {
              "function": {
                "description": "Get local time for a city.",
                "name": "get_time",
                "parameters": {
                  "properties": {
                    "city": {
                      "type": "string"
                    }
                  },
                  "required": [
                    "city"
                  ],
                  "type": "object"
                }
              },
              "type": "function"
            }
          ],
          "top_p": 1.0
        }
      },
      "response": {
        "status": 200,
        "headers": {
          "content-type": "text/event-stream",
          "date": "Mon, 20 Jul 2026 14:32:11 GMT",
          "transfer-encoding": "chunked"
        },
        "body_raw": "data: {\"id\":\"chatcmpl-627\",\"object\":\"chat.completion.chunk\",\"created\":1784557931,\"model\":\"qwen2.5:7b-instruct\",\"system_fingerprint\":\"fp_ollama\",\"choices\":[{\"index\":0,\"delta\":{\"role\":\"assistant\",\"content\":\"\",\"tool_calls\":[{\"id\":\"call_p8u8plrh\",\"index\":0,\"type\":\"function\",\"function\":{\"name\":\"get_time\",\"arguments\":\"{\\\"city\\\":\\\"Accra\\\"}\"}}]},\"finish_reason\":null}]}\n\ndata: {\"id\":\"chatcmpl-627\",\"object\":\"chat.completion.chunk\",\"created\":1784557931,\"model\":\"qwen2.5:7b-instruct\",\"system_fingerprint\":\"fp_ollama\",\"choices\":[{\"index\":0,\"delta\":{\"role\":\"assistant\",\"content\":\"\",\"tool_calls\":[{\"id\":\"call_ep78xraw\",\"index\":1,\"type\":\"function\",\"function\":{\"name\":\"get_time\",\"arguments\":\"{\\\"city\\\":\\\"Kyoto\\\"}\"}}]},\"finish_reason\":null}]}\n\ndata: {\"id\":\"chatcmpl-627\",\"object\":\"chat.completion.chunk\",\"created\":1784557932,\"model\":\"qwen2.5:7b-instruct\",\"system_fingerprint\":\"fp_ollama\",\"choices\":[{\"index\":0,\"delta\":{\"role\":\"assistant\",\"content\":\"\",\"tool_calls\":[{\"id\":\"call_8qz9nm0k\",\"index\":2,\"type\":\"function\",\"function\":{\"name\":\"get_time\",\"arguments\":\"{\\\"city\\\":\\\"Quito\\\"}\"}}]},\"finish_reason\":null}]}\n\ndata: {\"id\":\"chatcmpl-627\",\"object\":\"chat.completion.chunk\",\"created\":1784557932,\"model\":\"qwen2.5:7b-instruct\",\"system_fingerprint\":\"fp_ollama\",\"choices\":[{\"index\":0,\"delta\":{\"role\":\"assistant\",\"content\":\"\"},\"finish_reason\":\"tool_calls\"}]}\n\ndata: [DONE]\n\n"
      },
      "retried": false
    }
  ]
}
