{
  "schema_version": 1,
  "run_id": "20260720T144413Z-e9ac09f5",
  "scenario_id": "tool-choice-none",
  "turns": [
    {
      "index": 0,
      "request": {
        "method": "POST",
        "url": "http://localhost:11434/v1/chat/completions",
        "headers": {
          "content-type": "application/json"
        },
        "body": {
          "max_tokens": 1024,
          "messages": [
            {
              "content": "Reply with the exact text: no tools",
              "role": "user"
            }
          ],
          "model": "phi4-mini:latest",
          "seed": 42,
          "stream": false,
          "temperature": 0.0,
          "tool_choice": "none",
          "tools": [
            {
              "function": {
                "description": "Get weather for a city.",
                "name": "get_weather",
                "parameters": {
                  "properties": {
                    "city": {
                      "type": "string"
                    }
                  },
                  "required": [
                    "city"
                  ],
                  "type": "object"
                }
              },
              "type": "function"
            }
          ],
          "top_p": 1.0
        }
      },
      "response": {
        "status": 200,
        "headers": {
          "content-length": "298",
          "content-type": "application/json",
          "date": "Mon, 20 Jul 2026 14:45:01 GMT"
        },
        "body_raw": "{\"id\":\"chatcmpl-655\",\"object\":\"chat.completion\",\"created\":1784558701,\"model\":\"phi4-mini:latest\",\"system_fingerprint\":\"fp_ollama\",\"choices\":[{\"index\":0,\"message\":{\"role\":\"assistant\",\"content\":\"no tools\"},\"finish_reason\":\"stop\"}],\"usage\":{\"prompt_tokens\":66,\"completion_tokens\":3,\"total_tokens\":69}}\n"
      },
      "retried": false
    }
  ]
}
