{
  "schema_version": 1,
  "run_id": "20260720T181336Z-c1bc4979",
  "scenario_id": "tool-choice-none",
  "turns": [
    {
      "index": 0,
      "request": {
        "method": "POST",
        "url": "http://localhost:11434/v1/chat/completions",
        "headers": {
          "content-type": "application/json"
        },
        "body": {
          "max_tokens": 1024,
          "messages": [
            {
              "content": "Reply with the exact text: no tools",
              "role": "user"
            }
          ],
          "model": "hermes3:8b",
          "seed": 42,
          "stream": false,
          "temperature": 0.0,
          "tool_choice": "none",
          "tools": [
            {
              "function": {
                "description": "Get weather for a city.",
                "name": "get_weather",
                "parameters": {
                  "properties": {
                    "city": {
                      "type": "string"
                    }
                  },
                  "required": [
                    "city"
                  ],
                  "type": "object"
                }
              },
              "type": "function"
            }
          ],
          "top_p": 1.0
        }
      },
      "response": {
        "status": 200,
        "headers": {
          "content-length": "419",
          "content-type": "application/json",
          "date": "Mon, 20 Jul 2026 18:14:12 GMT"
        },
        "body_raw": "{\"id\":\"chatcmpl-119\",\"object\":\"chat.completion\",\"created\":1784571252,\"model\":\"hermes3:8b\",\"system_fingerprint\":\"fp_ollama\",\"choices\":[{\"index\":0,\"message\":{\"role\":\"assistant\",\"content\":\"I'm afraid I don't have any tools available to assist you at this time. Please let me know if there's anything else I can help with!\"},\"finish_reason\":\"stop\"}],\"usage\":{\"prompt_tokens\":230,\"completion_tokens\":32,\"total_tokens\":262}}\n"
      },
      "retried": false
    }
  ]
}
