{
  "schema_version": 1,
  "run_id": "20260720T182604Z-d59df055",
  "scenario_id": "parallel-two-searches",
  "turns": [
    {
      "index": 0,
      "request": {
        "method": "POST",
        "url": "http://127.0.0.1:8080/v1/chat/completions",
        "headers": {
          "content-type": "application/json"
        },
        "body": {
          "max_tokens": 1024,
          "messages": [
            {
              "content": "Run separate document searches for 'alpha protocol' and 'beta protocol'.",
              "role": "user"
            }
          ],
          "model": "Qwen/Qwen2.5-7B-Instruct-GGUF:Q8_0",
          "seed": 42,
          "stream": false,
          "temperature": 0.0,
          "tool_choice": "required",
          "tools": [
            {
              "function": {
                "description": "Search documents for an exact query.",
                "name": "search_docs",
                "parameters": {
                  "properties": {
                    "query": {
                      "type": "string"
                    }
                  },
                  "required": [
                    "query"
                  ],
                  "type": "object"
                }
              },
              "type": "function"
            }
          ],
          "top_p": 1.0
        }
      },
      "response": {
        "status": 200,
        "headers": {
          "access-control-allow-origin": "",
          "content-length": "953",
          "content-type": "application/json; charset=utf-8",
          "keep-alive": "timeout=5, max=100",
          "server": "llama.cpp"
        },
        "body_raw": "{\"choices\":[{\"finish_reason\":\"tool_calls\",\"index\":0,\"message\":{\"role\":\"assistant\",\"content\":\"\",\"tool_calls\":[{\"type\":\"function\",\"function\":{\"name\":\"search_docs\",\"arguments\":\"{\\\"query\\\": \\\"alpha protocol\\\"}\"},\"id\":\"qdWWevLOnfZ6JetoTmHmVoFYlbdEBPik\"},{\"type\":\"function\",\"function\":{\"name\":\"search_docs\",\"arguments\":\"{\\\"query\\\": \\\"beta protocol\\\"}\"},\"id\":\"GzoIU8YrHkJXZS0rahrl7mnzvZwfVxbP\"}]}}],\"created\":1784571990,\"model\":\"Qwen/Qwen2.5-7B-Instruct-GGUF:Q8_0\",\"system_fingerprint\":\"b10050-b15ca938a\",\"object\":\"chat.completion\",\"usage\":{\"completion_tokens\":42,\"prompt_tokens\":178,\"total_tokens\":220,\"prompt_tokens_details\":{\"cached_tokens\":67}},\"id\":\"chatcmpl-p1dSbBetfkUdwt73091oHkeJIP7thBEe\",\"timings\":{\"cache_n\":67,\"prompt_n\":111,\"prompt_ms\":138.359,\"prompt_per_token_ms\":1.2464774774774776,\"prompt_per_second\":802.2607853482606,\"predicted_n\":42,\"predicted_ms\":692.206,\"predicted_per_token_ms\":16.48109523809524,\"predicted_per_second\":60.6755792350832}}"
      },
      "retried": false
    }
  ]
}
