{
  "schema_version": 1,
  "run_id": "20260721T160019Z-4145246d",
  "scenario_id": "streaming-parallel-three",
  "turns": [
    {
      "index": 0,
      "request": {
        "method": "POST",
        "url": "http://127.0.0.1:8081/v1/chat/completions",
        "headers": {
          "content-type": "application/json"
        },
        "body": {
          "max_tokens": 1024,
          "messages": [
            {
              "content": "Get local time for Accra, Kyoto, and Quito with three calls.",
              "role": "user"
            }
          ],
          "model": "mlx-community/Qwen2.5-7B-Instruct-4bit",
          "seed": 42,
          "stream": true,
          "temperature": 0.0,
          "tool_choice": "required",
          "tools": [
            {
              "function": {
                "description": "Get local time for a city.",
                "name": "get_time",
                "parameters": {
                  "properties": {
                    "city": {
                      "type": "string"
                    }
                  },
                  "required": [
                    "city"
                  ],
                  "type": "object"
                }
              },
              "type": "function"
            }
          ],
          "top_p": 1.0
        }
      },
      "response": {
        "status": 200,
        "headers": {
          "access-control-allow-headers": "*",
          "access-control-allow-methods": "*",
          "access-control-allow-origin": "*",
          "cache-control": "no-cache",
          "content-type": "text/event-stream",
          "date": "Tue, 21 Jul 2026 16:00:45 GMT",
          "server": "BaseHTTP/0.6 Python/3.14.6"
        },
        "body_raw": ": keepalive 0/116\n\n: keepalive 115/116\n\n: keepalive 116/116\n\ndata: {\"id\": \"chatcmpl-2cdc05c4-4436-496f-8ea6-41a5caa65d84\", \"system_fingerprint\": \"0.31.3-0.32.0-macOS-26.5.2-arm64-arm-64bit-Mach-O-applegpu_g16s\", \"object\": \"chat.completion.chunk\", \"model\": \"mlx-community/Qwen2.5-7B-Instruct-4bit\", \"created\": 1784649645, \"choices\": [{\"index\": 0, \"finish_reason\": null, \"delta\": {\"role\": \"assistant\", \"tool_calls\": [{\"function\": {\"name\": \"get_time\", \"arguments\": \"{\\\"city\\\": \\\"Accra\\\"}\"}, \"type\": \"function\", \"id\": \"89da1376-a64d-455b-8614-28bfa3847681\", \"index\": 0}]}}]}\n\ndata: {\"id\": \"chatcmpl-2cdc05c4-4436-496f-8ea6-41a5caa65d84\", \"system_fingerprint\": \"0.31.3-0.32.0-macOS-26.5.2-arm64-arm-64bit-Mach-O-applegpu_g16s\", \"object\": \"chat.completion.chunk\", \"model\": \"mlx-community/Qwen2.5-7B-Instruct-4bit\", \"created\": 1784649645, \"choices\": [{\"index\": 0, \"finish_reason\": null, \"delta\": {\"role\": \"assistant\", \"content\": \"\\n\"}}]}\n\ndata: {\"id\": \"chatcmpl-2cdc05c4-4436-496f-8ea6-41a5caa65d84\", \"system_fingerprint\": \"0.31.3-0.32.0-macOS-26.5.2-arm64-arm-64bit-Mach-O-applegpu_g16s\", \"object\": \"chat.completion.chunk\", \"model\": \"mlx-community/Qwen2.5-7B-Instruct-4bit\", \"created\": 1784649645, \"choices\": [{\"index\": 0, \"finish_reason\": null, \"delta\": {\"role\": \"assistant\", \"tool_calls\": [{\"function\": {\"name\": \"get_time\", \"arguments\": \"{\\\"city\\\": \\\"Kyoto\\\"}\"}, \"type\": \"function\", \"id\": \"da48a7ac-2f6f-462a-876e-c23fc18b6239\", \"index\": 1}]}}]}\n\ndata: {\"id\": \"chatcmpl-2cdc05c4-4436-496f-8ea6-41a5caa65d84\", \"system_fingerprint\": \"0.31.3-0.32.0-macOS-26.5.2-arm64-arm-64bit-Mach-O-applegpu_g16s\", \"object\": \"chat.completion.chunk\", \"model\": \"mlx-community/Qwen2.5-7B-Instruct-4bit\", \"created\": 1784649645, \"choices\": [{\"index\": 0, \"finish_reason\": null, \"delta\": {\"role\": \"assistant\", \"content\": \"\\n\"}}]}\n\ndata: {\"id\": \"chatcmpl-2cdc05c4-4436-496f-8ea6-41a5caa65d84\", \"system_fingerprint\": \"0.31.3-0.32.0-macOS-26.5.2-arm64-arm-64bit-Mach-O-applegpu_g16s\", \"object\": \"chat.completion.chunk\", \"model\": \"mlx-community/Qwen2.5-7B-Instruct-4bit\", \"created\": 1784649645, \"choices\": [{\"index\": 0, \"finish_reason\": null, \"delta\": {\"role\": \"assistant\", \"tool_calls\": [{\"function\": {\"name\": \"get_time\", \"arguments\": \"{\\\"city\\\": \\\"Quito\\\"}\"}, \"type\": \"function\", \"id\": \"7ab30af3-5d5c-4deb-ad6f-17559e25f26e\", \"index\": 2}]}}]}\n\ndata: {\"id\": \"chatcmpl-2cdc05c4-4436-496f-8ea6-41a5caa65d84\", \"system_fingerprint\": \"0.31.3-0.32.0-macOS-26.5.2-arm64-arm-64bit-Mach-O-applegpu_g16s\", \"object\": \"chat.completion.chunk\", \"model\": \"mlx-community/Qwen2.5-7B-Instruct-4bit\", \"created\": 1784649645, \"choices\": [{\"index\": 0, \"finish_reason\": \"tool_calls\", \"delta\": {\"role\": \"assistant\"}}]}\n\ndata: [DONE]\n\n"
      },
      "retried": false
    }
  ]
}
